{
  "id": "empuje-tiron-pierna",
  "nombre": "Empuje, tirón y pierna",
  "resumen": "Tres sesiones organizadas por patrón de movimiento: los empujes juntos, los tirones juntos y las piernas aparte. Se hace una vez por semana en tres días, o dos veces en seis.",
  "nivel": "intermedio",
  "frecuencia": 3,
  "dias": [
    {
      "nombre": "Empuje",
      "ejercicios": [
        {
          "ejercicio": "press-banca",
          "series": 3,
          "min": 6,
          "max": 10
        },
        {
          "ejercicio": "press-militar",
          "series": 3,
          "min": 6,
          "max": 10
        },
        {
          "ejercicio": "aperturas-mancuernas",
          "series": 2,
          "min": 10,
          "max": 15
        },
        {
          "ejercicio": "elevaciones-laterales",
          "series": 3,
          "min": 12,
          "max": 20
        },
        {
          "ejercicio": "jalon-triceps",
          "series": 3,
          "min": 10,
          "max": 15
        },
        {
          "ejercicio": "extension-triceps-arriba",
          "series": 2,
          "min": 10,
          "max": 15
        }
      ]
    },
    {
      "nombre": "Tirón",
      "ejercicios": [
        {
          "ejercicio": "dominadas",
          "series": 3,
          "min": 5,
          "max": 10
        },
        {
          "ejercicio": "remo-barra",
          "series": 3,
          "min": 6,
          "max": 10
        },
        {
          "ejercicio": "remo-mancuerna",
          "series": 2,
          "min": 8,
          "max": 12
        },
        {
          "ejercicio": "pajaros-mancuernas",
          "series": 3,
          "min": 12,
          "max": 20
        },
        {
          "ejercicio": "curl-mancuernas",
          "series": 3,
          "min": 8,
          "max": 12
        },
        {
          "ejercicio": "curl-martillo",
          "series": 2,
          "min": 10,
          "max": 15
        }
      ]
    },
    {
      "nombre": "Pierna",
      "ejercicios": [
        {
          "ejercicio": "sentadilla-barra",
          "series": 3,
          "min": 6,
          "max": 10
        },
        {
          "ejercicio": "peso-muerto-rumano",
          "series": 3,
          "min": 8,
          "max": 10
        },
        {
          "ejercicio": "zancada-inversa",
          "series": 3,
          "min": 8,
          "max": 12
        },
        {
          "ejercicio": "elevacion-talones",
          "series": 3,
          "min": 10,
          "max": 15
        },
        {
          "ejercicio": "elevacion-rodillas",
          "series": 3,
          "min": 8,
          "max": 15
        }
      ]
    }
  ],
  "matices": "Hecha en tres días, cada músculo se entrena una vez por semana: funciona, pero las revisiones encuentran algo más de ganancia al entrenarlo dos veces, que es lo que da repetirla en seis días. Seis días piden recuperarse bien entre sesiones; para empezar, tres días y más adelante subir es lo prudente.",
  "fuentes": [
    {
      "titulo": "Progression models in resistance training for healthy adults",
      "autor": "American College of Sports Medicine, 2009",
      "url": "https://pubmed.ncbi.nlm.nih.gov/19204579/"
    },
    {
      "titulo": "Effects of Resistance Training Frequency on Measures of Muscle Hypertrophy: A Systematic Review and Meta-Analysis",
      "autor": "Schoenfeld, Ogborn y Krieger, 2016",
      "url": "https://pubmed.ncbi.nlm.nih.gov/27102172/"
    },
    {
      "titulo": "Dose-response relationship between weekly resistance training volume and increases in muscle mass",
      "autor": "Schoenfeld, Ogborn y Krieger, 2017",
      "url": "https://pubmed.ncbi.nlm.nih.gov/27433992/"
    }
  ]
}
