{
  "id": "torso-pierna",
  "nombre": "Upper and lower",
  "resumen": "Four days a week: two upper-body days and two lower-body days, with different variations on each. More volume per session than full body, for people who have been training for a few months.",
  "nivel": "intermedio",
  "frecuencia": 4,
  "dias": [
    {
      "nombre": "Upper A",
      "ejercicios": [
        {
          "ejercicio": "press-banca",
          "series": 3,
          "min": 6,
          "max": 10
        },
        {
          "ejercicio": "remo-barra",
          "series": 3,
          "min": 6,
          "max": 10
        },
        {
          "ejercicio": "press-militar-mancuernas",
          "series": 3,
          "min": 8,
          "max": 12
        },
        {
          "ejercicio": "jalon-pecho",
          "series": 3,
          "min": 8,
          "max": 12
        },
        {
          "ejercicio": "curl-mancuernas",
          "series": 2,
          "min": 10,
          "max": 15
        },
        {
          "ejercicio": "press-frances",
          "series": 2,
          "min": 10,
          "max": 15
        }
      ]
    },
    {
      "nombre": "Lower A",
      "ejercicios": [
        {
          "ejercicio": "sentadilla-barra",
          "series": 3,
          "min": 6,
          "max": 10
        },
        {
          "ejercicio": "peso-muerto-rumano",
          "series": 3,
          "min": 8,
          "max": 10
        },
        {
          "ejercicio": "zancada-mancuernas",
          "series": 3,
          "min": 8,
          "max": 12
        },
        {
          "ejercicio": "elevacion-talones",
          "series": 3,
          "min": 10,
          "max": 15
        },
        {
          "ejercicio": "plancha-lateral",
          "series": 3,
          "min": 20,
          "max": 40
        }
      ]
    },
    {
      "nombre": "Upper B",
      "ejercicios": [
        {
          "ejercicio": "press-banca-mancuernas",
          "series": 3,
          "min": 8,
          "max": 12
        },
        {
          "ejercicio": "dominadas",
          "series": 3,
          "min": 5,
          "max": 10
        },
        {
          "ejercicio": "press-militar",
          "series": 3,
          "min": 6,
          "max": 10
        },
        {
          "ejercicio": "remo-mancuerna",
          "series": 3,
          "min": 8,
          "max": 12
        },
        {
          "ejercicio": "elevaciones-laterales",
          "series": 3,
          "min": 12,
          "max": 20
        },
        {
          "ejercicio": "jalon-triceps",
          "series": 2,
          "min": 10,
          "max": 15
        }
      ]
    },
    {
      "nombre": "Lower B",
      "ejercicios": [
        {
          "ejercicio": "sentadilla-bulgara",
          "series": 3,
          "min": 8,
          "max": 12
        },
        {
          "ejercicio": "hip-thrust",
          "series": 3,
          "min": 8,
          "max": 12
        },
        {
          "ejercicio": "sentadilla-mancuernas",
          "series": 3,
          "min": 8,
          "max": 12
        },
        {
          "ejercicio": "elevacion-talones-sentado",
          "series": 3,
          "min": 12,
          "max": 20
        },
        {
          "ejercicio": "encogimiento-abdominal",
          "series": 3,
          "min": 10,
          "max": 15
        }
      ]
    }
  ],
  "matices": "With four days each muscle is still trained twice a week, but with more sets per session. More weekly volume is associated with more hypertrophy, although the relationship is not linear and the useful maximum depends on each person and their recovery. If a week does not allow four days, it is better to spread the sessions than to always skip the same ones.",
  "fuentes": [
    {
      "titulo": "Progression models in resistance training for healthy adults",
      "autor": "American College of Sports Medicine, 2009",
      "url": "https://pubmed.ncbi.nlm.nih.gov/19204579/"
    },
    {
      "titulo": "Effects of Resistance Training Frequency on Measures of Muscle Hypertrophy: A Systematic Review and Meta-Analysis",
      "autor": "Schoenfeld, Ogborn and Krieger, 2016",
      "url": "https://pubmed.ncbi.nlm.nih.gov/27102172/"
    },
    {
      "titulo": "Dose-response relationship between weekly resistance training volume and increases in muscle mass",
      "autor": "Schoenfeld, Ogborn and Krieger, 2017",
      "url": "https://pubmed.ncbi.nlm.nih.gov/27433992/"
    }
  ]
}
