{
  "id": "torso-pierna",
  "nombre": "Torso y pierna",
  "resumen": "Cuatro días por semana: dos de torso y dos de pierna, con variantes distintas en cada uno. Más volumen por sesión que el cuerpo completo, para quien ya lleva unos meses entrenando.",
  "nivel": "intermedio",
  "frecuencia": 4,
  "dias": [
    {
      "nombre": "Torso A",
      "ejercicios": [
        {
          "ejercicio": "press-banca",
          "series": 3,
          "min": 6,
          "max": 10
        },
        {
          "ejercicio": "remo-barra",
          "series": 3,
          "min": 6,
          "max": 10
        },
        {
          "ejercicio": "press-militar-mancuernas",
          "series": 3,
          "min": 8,
          "max": 12
        },
        {
          "ejercicio": "jalon-pecho",
          "series": 3,
          "min": 8,
          "max": 12
        },
        {
          "ejercicio": "curl-mancuernas",
          "series": 2,
          "min": 10,
          "max": 15
        },
        {
          "ejercicio": "press-frances",
          "series": 2,
          "min": 10,
          "max": 15
        }
      ]
    },
    {
      "nombre": "Pierna A",
      "ejercicios": [
        {
          "ejercicio": "sentadilla-barra",
          "series": 3,
          "min": 6,
          "max": 10
        },
        {
          "ejercicio": "peso-muerto-rumano",
          "series": 3,
          "min": 8,
          "max": 10
        },
        {
          "ejercicio": "zancada-mancuernas",
          "series": 3,
          "min": 8,
          "max": 12
        },
        {
          "ejercicio": "elevacion-talones",
          "series": 3,
          "min": 10,
          "max": 15
        },
        {
          "ejercicio": "plancha-lateral",
          "series": 3,
          "min": 20,
          "max": 40
        }
      ]
    },
    {
      "nombre": "Torso B",
      "ejercicios": [
        {
          "ejercicio": "press-banca-mancuernas",
          "series": 3,
          "min": 8,
          "max": 12
        },
        {
          "ejercicio": "dominadas",
          "series": 3,
          "min": 5,
          "max": 10
        },
        {
          "ejercicio": "press-militar",
          "series": 3,
          "min": 6,
          "max": 10
        },
        {
          "ejercicio": "remo-mancuerna",
          "series": 3,
          "min": 8,
          "max": 12
        },
        {
          "ejercicio": "elevaciones-laterales",
          "series": 3,
          "min": 12,
          "max": 20
        },
        {
          "ejercicio": "jalon-triceps",
          "series": 2,
          "min": 10,
          "max": 15
        }
      ]
    },
    {
      "nombre": "Pierna B",
      "ejercicios": [
        {
          "ejercicio": "sentadilla-bulgara",
          "series": 3,
          "min": 8,
          "max": 12
        },
        {
          "ejercicio": "hip-thrust",
          "series": 3,
          "min": 8,
          "max": 12
        },
        {
          "ejercicio": "sentadilla-mancuernas",
          "series": 3,
          "min": 8,
          "max": 12
        },
        {
          "ejercicio": "elevacion-talones-sentado",
          "series": 3,
          "min": 12,
          "max": 20
        },
        {
          "ejercicio": "encogimiento-abdominal",
          "series": 3,
          "min": 10,
          "max": 15
        }
      ]
    }
  ],
  "matices": "Con cuatro días cada músculo vuelve a trabajarse dos veces por semana, pero con más series por sesión. Más volumen semanal se asocia con más hipertrofia, aunque la relación no es lineal y el máximo útil depende de cada persona y de su recuperación. Si una semana no da para cuatro días, es mejor repartir que saltarse siempre los mismos.",
  "fuentes": [
    {
      "titulo": "Progression models in resistance training for healthy adults",
      "autor": "American College of Sports Medicine, 2009",
      "url": "https://pubmed.ncbi.nlm.nih.gov/19204579/"
    },
    {
      "titulo": "Effects of Resistance Training Frequency on Measures of Muscle Hypertrophy: A Systematic Review and Meta-Analysis",
      "autor": "Schoenfeld, Ogborn y Krieger, 2016",
      "url": "https://pubmed.ncbi.nlm.nih.gov/27102172/"
    },
    {
      "titulo": "Dose-response relationship between weekly resistance training volume and increases in muscle mass",
      "autor": "Schoenfeld, Ogborn y Krieger, 2017",
      "url": "https://pubmed.ncbi.nlm.nih.gov/27433992/"
    }
  ]
}
